{
  "contract_version": "0.4",
  "id": "20000000-0000-4000-8000-000000000101",
  "key": "R-INTERNAL-PRESSURE-V2",
  "name": "Internal pressure",
  "description": "Erkennt explizite Notwendigkeitssprache außerhalb eines Sicherheitskontexts.",
  "priority": 100,
  "enabled": true,
  "scope": "TEXT",
  "status": "TESTING",
  "version": 1,
  "evidence_class": "B",
  "source_keys": ["REFERENCE_ENGINE_V0_4_1"],
  "condition": {
    "op": "AND",
    "children": [
      {"field": "tokens", "operator": "CONTAINS", "value": "müssen"},
      {"field": "context", "operator": "NOT_EQUALS", "value": "SAFETY"}
    ]
  },
  "actions": [
    {"type": "ADD_PATTERN", "key": "INTERNAL_PRESSURE"},
    {"type": "ADD_CONTRIBUTION", "dimension": "VOLITION", "value": -10, "confidence": 0.9, "reason_key": "INTERNAL_PRESSURE_VOLITION", "evidence_key": "EVIDENCE_INTERNAL_PRESSURE"},
    {"type": "ADD_CONTRIBUTION", "dimension": "OPENNESS", "value": -4, "confidence": 0.8, "reason_key": "INTERNAL_PRESSURE_OPENNESS", "evidence_key": "EVIDENCE_INTERNAL_PRESSURE"}
  ],
  "confidence_modifier": 1,
  "stop_processing": false
}
